{
  "values": {
    "cash": 1,
    "ultimate-rewards": {
      "withUnlocker": 1.5,
      "withoutUnlocker": 1.0
    },
    "citi-thankyou": {
      "withUnlocker": 1.5,
      "withoutUnlocker": 1.0
    },
    "capital-one-miles": {
      "withUnlocker": 1.45,
      "withoutUnlocker": 1.0
    },
    "amex-membership-rewards": 1.5,
    "wells-fargo-rewards": 1.4,
    "bilt": 1.55,
    "rove": 1.4,
    "aeroplan": 1.4,
    "american-aadvantage": 1.4,
    "atmos-rewards": 1.5,
    "air-france-klm-flying-blue": 1.3,
    "avianca-lifemiles": 1.3,
    "avios": 1.1,
    "cathay-pacific-asia-miles": 1.1,
    "delta-skymiles": 1.1,
    "frontier-bonus-miles": 1.0,
    "jetblue-trueblue": 1.3,
    "korean-skypass": 1.3,
    "miles-and-more": 1.3,
    "qantas-frequent-flyer": 1.3,
    "southwest-rapid-rewards": 1.3,
    "united-mileageplus": 1.3,
    "virgin-atlantic-flying-club": 1.5,
    "best-western-rewards": 0.61,
    "choice-privileges": 0.75,
    "hilton-honors": 0.35,
    "ihg-one-rewards": 0.59,
    "leading-hotels-leaders-club": 7.6,
    "marriott-bonvoy": 0.73,
    "one-key": 0.9,
    "preferred-hotels-i-prefer": 0.49,
    "sonesta-travel-pass": 1.06,
    "world-of-hyatt": 1.5,
    "wyndham-rewards": 0.57,
    "amtrak-guest-rewards": 2.56,
    "arrival-plus": 1.0,
    "cnb-rewards": 1.11,
    "flexperks": 1.5,
    "merrill-plus": 1.44,
    "penfed-premium-travel": 0.85,
    "uber-cash": 0.9,
    "default-bank-points": 1.0
  },
  "freeNightCertificates": {
    "marriott-35k": 192,
    "marriott-40k": 219,
    "marriott-50k": 274,
    "marriott-85k": 465,
    "hilton": 521,
    "hyatt-cat-1-4": 240,
    "hyatt-cat-1-7": 420,
    "hyatt-ultimate-6-month": 578,
    "ihg-40k": 201,
    "ihg-60k": 248
  },
  "notes": {
    "_source": "Frequent Miler Reasonable Redemption Values, treated as definitive by the site owner (2026-09-20): https://frequentmiler.com/reasonable-redemption-values-rrvs/ . Reference copy: data/reference/frequentmiler-rrv.json.",
    "ultimate-rewards": "withUnlocker = travel redemption (needs a Sapphire or Ink Preferred to transfer); withoutUnlocker = cash redemption, 1.0 cent.",
    "citi-thankyou": "withoutUnlocker is the cash-out value, 1.0 cent (site owner). Transfers need a Strata Elite or Strata Premier.",
    "capital-one-miles": "withoutUnlocker is the cash-out value, 1.0 cent (site owner). Transfers need a miles-earning card.",
    "leading-hotels-leaders-club": "Frequent Miler lists 7.6 (updated 9/7/26).",
    "all-accor": "Not included: Frequent Miler gives 2.0 euro cents, not a US-dollar value."
  },
  "verifiedOn": "2026-10-09"
}